{
  "block_id": "minecraft:oak_stairs",
  "release_id": "rel_ec8397fe58cb4faba5fa15b1de406ca0",
  "total": 80,
  "offset": 0,
  "next_offset": 1,
  "states": [
    {
      "state_id": "minecraft:oak_stairs[facing=east,half=bottom,shape=inner_left,waterlogged=false]",
      "is_default": false,
      "properties": {
        "facing": "east",
        "half": "bottom",
        "shape": "inner_left",
        "waterlogged": "false"
      },
      "shape": [
        {
          "max_x": 1,
          "max_y": 0.5,
          "max_z": 1,
          "min_x": 0,
          "min_y": 0,
          "min_z": 0
        },
        {
          "max_x": 1,
          "max_y": 1,
          "max_z": 0.5,
          "min_x": 0,
          "min_y": 0.5,
          "min_z": 0
        },
        {
          "max_x": 1,
          "max_y": 1,
          "max_z": 1,
          "min_x": 0.5,
          "min_y": 0.5,
          "min_z": 0.5
        }
      ],
      "behavior": {
        "emission_level": 0,
        "emissive": false,
        "passable": false,
        "redstone_related": false,
        "transparent": false,
        "waterloggable": true
      },
      "variant_ids": [
        "minecraft:oak_stairs"
      ],
      "mapping_status": "mapped"
    }
  ]
}
